{
  "schemaVersion": "1.1.0",
  "libraryId": "animalbank_stage1_teaching_asset_library_v1_1",
  "title": "Animal Bank 第一学段 Teaching Asset Library V1.1 Final",
  "stageId": "stage_1",
  "grades": [
    1,
    2
  ],
  "status": "frozen_for_v3_p0",
  "purpose": "把 Curriculum Library 中已经确定的音乐材料，转成可被 Content Factory、Teaching Asset Resolver、Lesson Recipe Generator 与 Classroom Runtime 直接调用的标准教学资产。",
  "corePrinciples": [
    "Teaching Asset 回答“这个音乐材料怎么教”。",
    "Teaching Asset 与具体歌曲解耦。",
    "第一学段 Rhythm 教学采用时值唱名与身体动作同步教学。",
    "身体动作优先大动作、高对比、低精细度，适合1–2年级儿童执行。",
    "一个 Rhythm Pattern 最多使用2类主要身体动作；左右拍腿视为同一类交替动作体系。",
    "DOG 负责清楚示范，不承担动作评分。",
    "训练音频在 Content Factory 阶段预生成或缓存，课堂不依赖实时生成。",
    "Melody/Singing 的具体 pitch、solfege、lyrics、duration 必须来自 Verified Score。",
    "短旋律 Phrase 是旋律教学的主对象；上行、下行、重复音、do-mi-sol 等作为 Feature Support。",
    "Teaching Asset 审核与具体 Song Publication 审核分开。"
  ],
  "namingRules": {
    "characterName": "DOG",
    "forbiddenLegacyNames": [
      "BEGO",
      "bego"
    ],
    "runtimeExample": "WATCH_DOG",
    "assetPrefixExample": "dog_rhythm_pat03"
  },
  "actionVocabulary": {
    "CLAP": {
      "labelZh": "拍手",
      "instructionZh": "双手在胸前自然拍一下。",
      "bodyZone": "上半身",
      "motorType": "gross_motor",
      "soundProducing": true
    },
    "PAT": {
      "labelZh": "双手拍腿",
      "instructionZh": "双手同时拍两侧大腿一下。",
      "bodyZone": "大腿",
      "motorType": "gross_motor",
      "soundProducing": true
    },
    "PAT_LEFT": {
      "labelZh": "左手拍左腿",
      "instructionZh": "左手拍左侧大腿一下。",
      "bodyZone": "左侧大腿",
      "motorType": "gross_motor",
      "soundProducing": true
    },
    "PAT_RIGHT": {
      "labelZh": "右手拍右腿",
      "instructionZh": "右手拍右侧大腿一下。",
      "bodyZone": "右侧大腿",
      "motorType": "gross_motor",
      "soundProducing": true
    },
    "STOMP": {
      "labelZh": "原地跺脚",
      "instructionZh": "原地自然踩地一下，不要求跳起。",
      "bodyZone": "脚下",
      "motorType": "gross_motor",
      "soundProducing": true
    },
    "FREEZE": {
      "labelZh": "张开双手定格",
      "instructionZh": "双手自然张开在身体两侧，身体和声音同时停住，心里继续数拍。",
      "bodyZone": "全身",
      "motorType": "gross_motor",
      "soundProducing": false,
      "internalPulseContinues": true
    }
  },
  "rhythmTeachingPolicy": {
    "runtimeFlow": [
      "LISTEN",
      "WATCH_DOG",
      "CHANT_AND_PLAY",
      "PRACTICE",
      "DONE"
    ],
    "stateDefinitions": {
      "LISTEN": {
        "system": "播放目标节奏示范。",
        "child": "先听，不要求立即动作。"
      },
      "WATCH_DOG": {
        "system": "DOG 同步示范时值唱名对应的身体动作。",
        "child": "观察节奏、唱名和动作的对应关系。"
      },
      "CHANT_AND_PLAY": {
        "system": "显示节奏符号与时值唱名，并给出同步节拍提示。",
        "child": "一边唱时值唱名，一边做对应身体动作。",
        "synchronized": true
      },
      "PRACTICE": {
        "system": "播放 Training Audio 循环。",
        "child": "连续重复“嘴巴唱 + 身体做”，熟悉后可逐渐弱化系统唱名提示。"
      },
      "DONE": {
        "system": "结束当前 Pattern 学习。",
        "child": "完成目标 Pattern 的同步唱与动。"
      }
    },
    "teachingMapping": {
      "notation": "节奏符号",
      "chant": "时值唱名",
      "bodyAction": "身体动作",
      "goal": "建立节奏符号 ↔ 时值唱名 ↔ 身体动作的三重对应"
    },
    "chantSystem": {
      "quarter": "da",
      "eighth": "de",
      "sixteenth": "di",
      "rest": "kong"
    },
    "bodyDesignRules": [
      "动作必须清楚明确，儿童看一次即可模仿。",
      "优先使用拍手、拍腿、跺脚、定格等大动作。",
      "不同动作之间身体位置差异要明显。",
      "不使用手指轻点等精细动作作为核心节奏动作。",
      "不要求动作角度、力度或拍击位置高度精确。",
      "教学目标是节奏结构外化，不是舞蹈动作精度。",
      "Runtime 不对儿童具体姿势进行动作评分。"
    ]
  },
  "countInPolicy": {
    "unit": "measure",
    "measures": 1,
    "deriveBeatsFromMeter": true,
    "examples": {
      "2/4": 2,
      "3/4": 3,
      "4/4": 4
    }
  },
  "trainingTempoPolicy": {
    "status": "product_default",
    "note": "以下为产品训练默认值，不是课程标准规定值；Lesson Recipe 可在审核后覆盖。",
    "simplePatterns": {
      "materialIds": [
        "PAT-01",
        "PAT-02",
        "PAT-03",
        "PAT-04"
      ],
      "preferredBpm": 80,
      "minBpm": 60,
      "maxBpm": 96
    },
    "sixteenthPatterns": {
      "materialIds": [
        "PAT-05",
        "PAT-06",
        "PAT-07"
      ],
      "preferredBpm": 64,
      "minBpm": 52,
      "maxBpm": 76
    },
    "extensionPatterns": {
      "materialIds": [
        "PAT-08"
      ],
      "preferredBpm": 72,
      "minBpm": 60,
      "maxBpm": 84
    }
  },
  "sharedAudioSpecs": {
    "rhythmTrainingAudio": {
      "structure": [
        "count_in",
        "pulse",
        "target_pattern"
      ],
      "defaultRepeatCount": 8,
      "delivery": "pre_generated_or_cached"
    },
    "melodyReferenceAudio": {
      "variants": [
        "reference_vocal",
        "solfege_vocal",
        "reference_pitch_or_piano"
      ]
    },
    "melodyPracticeAudio": {
      "structure": [
        "count_in",
        "practice_accompaniment"
      ],
      "optional": [
        "reference_pitch"
      ]
    },
    "groupRehearsalAudio": {
      "variants": [
        "rhythm_group",
        "singing_group",
        "together"
      ]
    }
  },
  "rhythmTeachingAssets": [
    {
      "assetId": "TA-RHY-PAT-01",
      "materialId": "PAT-01",
      "name": "一拍一次",
      "level": "core",
      "notation": "♩ ♩",
      "chant": [
        "da",
        "da"
      ],
      "durations": [
        1,
        1
      ],
      "bodyActions": [
        "STOMP",
        "STOMP"
      ],
      "bodyActionsZh": [
        "原地跺脚",
        "原地跺脚"
      ],
      "dogDemo": {
        "assetId": "dog_rhythm_pat01",
        "availability": "required_not_created"
      },
      "trainingTempoRef": "simplePatterns",
      "p0Eligible": true
    },
    {
      "assetId": "TA-RHY-PAT-02",
      "materialId": "PAT-02",
      "name": "一拍两次",
      "level": "core",
      "notation": "♪♪ ♪♪",
      "chant": [
        "de",
        "de",
        "de",
        "de"
      ],
      "durations": [
        0.5,
        0.5,
        0.5,
        0.5
      ],
      "bodyActions": [
        "CLAP",
        "CLAP",
        "CLAP",
        "CLAP"
      ],
      "bodyActionsZh": [
        "拍手",
        "拍手",
        "拍手",
        "拍手"
      ],
      "dogDemo": {
        "assetId": "dog_rhythm_pat02",
        "availability": "required_not_created"
      },
      "trainingTempoRef": "simplePatterns",
      "p0Eligible": true
    },
    {
      "assetId": "TA-RHY-PAT-03",
      "materialId": "PAT-03",
      "name": "前密后疏",
      "level": "core",
      "notation": "♪♪ ♩",
      "chant": [
        "de",
        "de",
        "da"
      ],
      "durations": [
        0.5,
        0.5,
        1
      ],
      "bodyActions": [
        "CLAP",
        "CLAP",
        "PAT"
      ],
      "bodyActionsZh": [
        "拍手",
        "拍手",
        "双手拍腿"
      ],
      "dogDemo": {
        "assetId": "dog_rhythm_pat03",
        "availability": "required_not_created"
      },
      "trainingTempoRef": "simplePatterns",
      "p0Eligible": true
    },
    {
      "assetId": "TA-RHY-PAT-04",
      "materialId": "PAT-04",
      "name": "前疏后密",
      "level": "core",
      "notation": "♩ ♪♪",
      "chant": [
        "da",
        "de",
        "de"
      ],
      "durations": [
        1,
        0.5,
        0.5
      ],
      "bodyActions": [
        "PAT",
        "CLAP",
        "CLAP"
      ],
      "bodyActionsZh": [
        "双手拍腿",
        "拍手",
        "拍手"
      ],
      "dogDemo": {
        "assetId": "dog_rhythm_pat04",
        "availability": "required_not_created"
      },
      "trainingTempoRef": "simplePatterns",
      "p0Eligible": true
    },
    {
      "assetId": "TA-RHY-PAT-05",
      "materialId": "PAT-05",
      "name": "一拍四次",
      "level": "core_progression",
      "notation": "𝅘𝅥𝅯𝅘𝅥𝅯𝅘𝅥𝅯𝅘𝅥𝅯",
      "chant": [
        "di",
        "di",
        "di",
        "di"
      ],
      "durations": [
        0.25,
        0.25,
        0.25,
        0.25
      ],
      "bodyActions": [
        "PAT_LEFT",
        "PAT_RIGHT",
        "PAT_LEFT",
        "PAT_RIGHT"
      ],
      "bodyActionsZh": [
        "左手拍左腿",
        "右手拍右腿",
        "左手拍左腿",
        "右手拍右腿"
      ],
      "dogDemo": {
        "assetId": "dog_rhythm_pat05",
        "availability": "required_not_created"
      },
      "trainingTempoRef": "sixteenthPatterns",
      "p0Eligible": true
    },
    {
      "assetId": "TA-RHY-PAT-06",
      "materialId": "PAT-06",
      "name": "前十六型",
      "level": "progression",
      "notation": "𝅘𝅥𝅯𝅘𝅥𝅯♪",
      "chant": [
        "di",
        "di",
        "de"
      ],
      "durations": [
        0.25,
        0.25,
        0.5
      ],
      "bodyActions": [
        "PAT_LEFT",
        "PAT_RIGHT",
        "CLAP"
      ],
      "bodyActionsZh": [
        "左手拍左腿",
        "右手拍右腿",
        "拍手"
      ],
      "dogDemo": {
        "assetId": "dog_rhythm_pat06",
        "availability": "required_not_created"
      },
      "trainingTempoRef": "sixteenthPatterns",
      "p0Eligible": true
    },
    {
      "assetId": "TA-RHY-PAT-07",
      "materialId": "PAT-07",
      "name": "后十六型",
      "level": "progression",
      "notation": "♪𝅘𝅥𝅯𝅘𝅥𝅯",
      "chant": [
        "de",
        "di",
        "di"
      ],
      "durations": [
        0.5,
        0.25,
        0.25
      ],
      "bodyActions": [
        "CLAP",
        "PAT_LEFT",
        "PAT_RIGHT"
      ],
      "bodyActionsZh": [
        "拍手",
        "左手拍左腿",
        "右手拍右腿"
      ],
      "dogDemo": {
        "assetId": "dog_rhythm_pat07",
        "availability": "required_not_created"
      },
      "trainingTempoRef": "sixteenthPatterns",
      "p0Eligible": true
    },
    {
      "assetId": "TA-RHY-PAT-08",
      "materialId": "PAT-08",
      "name": "小切分体验",
      "level": "experience_extension",
      "notation": "♪ ♩ ♪",
      "chant": [
        "de",
        "da",
        "de"
      ],
      "durations": [
        0.5,
        1,
        0.5
      ],
      "bodyActions": [
        "CLAP",
        "PAT",
        "CLAP"
      ],
      "bodyActionsZh": [
        "拍手",
        "双手拍腿",
        "拍手"
      ],
      "dogDemo": {